{
  "contract_version": "atlas.knowledge-candidate.v2",
  "candidate_id": "creation-os-xr-device-novelty-trap",
  "kind": "failure-mode",
  "name": "XR and Device Novelty Trap",
  "statement": "XR or device novelty consumes the software-builder roadmap before the first wedge has repeatable value, trust, and safe execution evidence.",
  "scope": "spatial viewers, headsets, scene standards, smart-home protocols, robotics, sensors, actuators, and hardware support.",
  "provenance": [
    {
      "source_type": "repository",
      "ref": "git:fawxzzy/ATLAS@c376810ec75066fb6b21d950f56fcdf986421889:docs/ops/ATLAS-CREATION-OS-PLAYBOOK-PROMOTION-CANDIDATES-2026-07-16.md#creation-os-xr-device-novelty-trap",
      "classification": "verified"
    },
    {
      "source_type": "repository",
      "ref": "git:fawxzzy/ATLAS@1d79d4ac3191dade11a2aa7c40352a5f210d35e2:docs/architecture/ATLAS-CREATION-OS-TARGET-ARCHITECTURE.md#staged-roadmap",
      "classification": "verified"
    },
    {
      "source_type": "repository",
      "ref": "git:fawxzzy/ATLAS@1d79d4ac3191dade11a2aa7c40352a5f210d35e2:docs/architecture/ATLAS-CREATION-OS-TARGET-ARCHITECTURE.md#success-metrics-and-kill-criteria",
      "classification": "verified"
    },
    {
      "source_type": "external-source",
      "ref": "git:fawxzzy/ATLAS@1d79d4ac3191dade11a2aa7c40352a5f210d35e2:data/imports/creation-os/deep-research-2026-07-16/deep-research-report.md#lines=11,248-250,355-356,369-370",
      "classification": "reported"
    },
    {
      "source_type": "repository",
      "ref": "git:fawxzzy/playbook@8aa912b492e689fca4c296d59a438c2813cba4fc:packages/engine/src/memory/atlasCandidateAdmission.ts",
      "classification": "verified"
    }
  ],
  "review": {
    "status": "candidate",
    "reviewer": null,
    "reviewed_at": null,
    "decision_note": null
  },
  "suggested_destination": "Playbook/failure-modes",
  "created_at": "2026-07-16T06:31:44Z",
  "extensions": {
    "atlas_projection": {
      "source_packet_ref": "docs/ops/ATLAS-CREATION-OS-PLAYBOOK-PROMOTION-CANDIDATES-2026-07-16.md",
      "source_packet_first_commit": "2407b0e656775d040099e5618eb194c5c06ee0e7",
      "source_packet_corrected_revision": "c376810ec75066fb6b21d950f56fcdf986421889",
      "source_adoption_merge_commit": "1d79d4ac3191dade11a2aa7c40352a5f210d35e2",
      "source_statement_sha256": "sha256:792d0a78d60d3997e2a9a0256908a3ff0c2c57f19f506c9a0be160cf2f9892b8",
      "source_scope_sha256": "sha256:3ef15743b0c02b1ad98eed32b0abafcf424bf57b0122792c4bd06aadcd43a964",
      "created_at_basis": "First durable Git commit containing the source candidate packet."
    },
    "playbook_consumer_contract": {
      "repository": "fawxzzy/playbook",
      "observed_revision": "8aa912b492e689fca4c296d59a438c2813cba4fc",
      "contract_path": "packages/engine/src/memory/atlasCandidateAdmission.ts",
      "accepted_mapping": {
        "kind": "failure-mode",
        "destination": "Playbook/failure-modes"
      }
    }
  }
}
