{
  "contract_version": "atlas.knowledge-candidate.v2",
  "candidate_id": "creation-os-platform-surface-vertical-contracts",
  "kind": "pattern",
  "name": "Platform, Surface, and Vertical Contracts",
  "statement": "Core platform, surfaces, and verticals evolve independently through explicit versioned contracts and owner boundaries.",
  "scope": "Atlas root, Playbook, Contracts, Cortex, `_stack`, DiscordOS, owner repositories, user surfaces, and domain products.",
  "provenance": [
    {
      "source_type": "repository",
      "ref": "git:fawxzzy/ATLAS@2407b0e656775d040099e5618eb194c5c06ee0e7:docs/ops/ATLAS-CREATION-OS-PLAYBOOK-PROMOTION-CANDIDATES-2026-07-16.md#creation-os-platform-surface-vertical-contracts",
      "classification": "verified"
    },
    {
      "source_type": "repository",
      "ref": "git:fawxzzy/ATLAS@1d79d4ac3191dade11a2aa7c40352a5f210d35e2:docs/architecture/ATLAS-CREATION-OS-TARGET-ARCHITECTURE.md#current-truth-and-target-ownership",
      "classification": "verified"
    },
    {
      "source_type": "repository",
      "ref": "git:fawxzzy/ATLAS@1d79d4ac3191dade11a2aa7c40352a5f210d35e2:docs/atlas-book/06-system-ownership.md",
      "classification": "verified"
    },
    {
      "source_type": "repository",
      "ref": "git:fawxzzy/ATLAS@1d79d4ac3191dade11a2aa7c40352a5f210d35e2:docs/atlas-book/07-contracts-and-seams.md",
      "classification": "verified"
    },
    {
      "source_type": "external-source",
      "ref": "git:fawxzzy/ATLAS@1d79d4ac3191dade11a2aa7c40352a5f210d35e2:data/imports/creation-os/deep-research-2026-07-16/deep-research-report.md#lines=23-27",
      "classification": "reported"
    },
    {
      "source_type": "repository",
      "ref": "git:fawxzzy/playbook@8aa912b492e689fca4c296d59a438c2813cba4fc:packages/engine/src/memory/atlasCandidateAdmission.ts",
      "classification": "verified"
    }
  ],
  "review": {
    "status": "candidate",
    "reviewer": null,
    "reviewed_at": null,
    "decision_note": null
  },
  "suggested_destination": "Playbook/patterns",
  "created_at": "2026-07-16T06:31:44Z",
  "extensions": {
    "atlas_projection": {
      "source_packet_ref": "docs/ops/ATLAS-CREATION-OS-PLAYBOOK-PROMOTION-CANDIDATES-2026-07-16.md",
      "source_packet_first_commit": "2407b0e656775d040099e5618eb194c5c06ee0e7",
      "source_adoption_merge_commit": "1d79d4ac3191dade11a2aa7c40352a5f210d35e2",
      "source_statement_sha256": "sha256:6acbfe34686350cf933dbc43cdad5f66885549223c7abc35af402fdb985dae5b",
      "source_scope_sha256": "sha256:a16c24e2d2b598738aeb106ab139d4fd23b14d7371ff02dc16e47580f69544c0",
      "created_at_basis": "First durable Git commit containing the source candidate packet."
    },
    "playbook_consumer_contract": {
      "repository": "fawxzzy/playbook",
      "observed_revision": "8aa912b492e689fca4c296d59a438c2813cba4fc",
      "contract_path": "packages/engine/src/memory/atlasCandidateAdmission.ts",
      "accepted_mapping": {
        "kind": "pattern",
        "destination": "Playbook/patterns"
      }
    }
  }
}
