{
  "contract_version": "atlas.knowledge-candidate.v2",
  "candidate_id": "creation-os-infrastructure-shopping-before-wedge",
  "kind": "failure-mode",
  "name": "Infrastructure Shopping Before the Wedge",
  "statement": "Infrastructure shopping before the native-first wedge is proven turns a vendor list into architecture, creates operational burden, and hides the product-learning loop.",
  "scope": "databases, vector/graph stores, caches, object stores, workflow engines, realtime transports, policy engines, signing systems, and provider routers.",
  "provenance": [
    {
      "source_type": "repository",
      "ref": "git:fawxzzy/ATLAS@c376810ec75066fb6b21d950f56fcdf986421889:docs/ops/ATLAS-CREATION-OS-PLAYBOOK-PROMOTION-CANDIDATES-2026-07-16.md#creation-os-infrastructure-shopping-before-wedge",
      "classification": "verified"
    },
    {
      "source_type": "repository",
      "ref": "git:fawxzzy/ATLAS@1d79d4ac3191dade11a2aa7c40352a5f210d35e2:docs/audits/ATLAS-CREATION-OS-RESEARCH-RECONCILIATION-2026-07-16.md#recommendation-mapping",
      "classification": "verified"
    },
    {
      "source_type": "repository",
      "ref": "git:fawxzzy/ATLAS@1d79d4ac3191dade11a2aa7c40352a5f210d35e2:docs/architecture/ATLAS-CREATION-OS-TARGET-ARCHITECTURE.md#phase-one-non-goals",
      "classification": "verified"
    },
    {
      "source_type": "external-source",
      "ref": "git:fawxzzy/ATLAS@1d79d4ac3191dade11a2aa7c40352a5f210d35e2:data/imports/creation-os/deep-research-2026-07-16/deep-research-report.md#lines=222-228,260-271",
      "classification": "reported"
    },
    {
      "source_type": "repository",
      "ref": "git:fawxzzy/playbook@8aa912b492e689fca4c296d59a438c2813cba4fc:packages/engine/src/memory/atlasCandidateAdmission.ts",
      "classification": "verified"
    }
  ],
  "review": {
    "status": "candidate",
    "reviewer": null,
    "reviewed_at": null,
    "decision_note": null
  },
  "suggested_destination": "Playbook/failure-modes",
  "created_at": "2026-07-16T06:31:44Z",
  "extensions": {
    "atlas_projection": {
      "source_packet_ref": "docs/ops/ATLAS-CREATION-OS-PLAYBOOK-PROMOTION-CANDIDATES-2026-07-16.md",
      "source_packet_first_commit": "2407b0e656775d040099e5618eb194c5c06ee0e7",
      "source_packet_corrected_revision": "c376810ec75066fb6b21d950f56fcdf986421889",
      "source_adoption_merge_commit": "1d79d4ac3191dade11a2aa7c40352a5f210d35e2",
      "source_statement_sha256": "sha256:1d6a53a2298696bc28e52c3149fae4fb2ab3bd5f3d87aba3bbaefde8d0cbaca1",
      "source_scope_sha256": "sha256:8d66a9fc8d7a9b7bfa179047c4f58ec8c94b88e0357aafe2c699ae480f4c5c2b",
      "created_at_basis": "First durable Git commit containing the source candidate packet."
    },
    "playbook_consumer_contract": {
      "repository": "fawxzzy/playbook",
      "observed_revision": "8aa912b492e689fca4c296d59a438c2813cba4fc",
      "contract_path": "packages/engine/src/memory/atlasCandidateAdmission.ts",
      "accepted_mapping": {
        "kind": "failure-mode",
        "destination": "Playbook/failure-modes"
      }
    }
  }
}
