{
  "contract_version": "atlas.knowledge-candidate.v2",
  "candidate_id": "creation-os-bootstrap-pointer-not-memory",
  "kind": "rule",
  "name": "Bootstrap Pointer, Not Memory",
  "statement": "The bootstrap artifact is a pointer into governed truth, never the entire memory system.",
  "scope": "recovery, profile/context bootstrap, memory, indexes, storage, and cross-machine restore.",
  "provenance": [
    {
      "source_type": "repository",
      "ref": "git:fawxzzy/ATLAS@c376810ec75066fb6b21d950f56fcdf986421889:docs/ops/ATLAS-CREATION-OS-PLAYBOOK-PROMOTION-CANDIDATES-2026-07-16.md#creation-os-bootstrap-pointer-not-memory",
      "classification": "verified"
    },
    {
      "source_type": "repository",
      "ref": "git:fawxzzy/ATLAS@1d79d4ac3191dade11a2aa7c40352a5f210d35e2:docs/atlas/decisions/adr-signed-versioned-atlas-bootstrap-manifest.md",
      "classification": "verified"
    },
    {
      "source_type": "repository",
      "ref": "git:fawxzzy/ATLAS@1d79d4ac3191dade11a2aa7c40352a5f210d35e2:docs/architecture/STATE-AND-MEMORY-BOUNDARIES.md",
      "classification": "verified"
    },
    {
      "source_type": "external-source",
      "ref": "git:fawxzzy/ATLAS@1d79d4ac3191dade11a2aa7c40352a5f210d35e2:data/imports/creation-os/deep-research-2026-07-16/deep-research-report.md#lines=7,218",
      "classification": "reported"
    },
    {
      "source_type": "repository",
      "ref": "git:fawxzzy/playbook@8aa912b492e689fca4c296d59a438c2813cba4fc:packages/engine/src/memory/atlasCandidateAdmission.ts",
      "classification": "verified"
    }
  ],
  "review": {
    "status": "candidate",
    "reviewer": null,
    "reviewed_at": null,
    "decision_note": null
  },
  "suggested_destination": "Playbook/rules",
  "created_at": "2026-07-16T06:31:44Z",
  "extensions": {
    "atlas_projection": {
      "source_packet_ref": "docs/ops/ATLAS-CREATION-OS-PLAYBOOK-PROMOTION-CANDIDATES-2026-07-16.md",
      "source_packet_first_commit": "2407b0e656775d040099e5618eb194c5c06ee0e7",
      "source_packet_corrected_revision": "c376810ec75066fb6b21d950f56fcdf986421889",
      "source_adoption_merge_commit": "1d79d4ac3191dade11a2aa7c40352a5f210d35e2",
      "source_statement_sha256": "sha256:ec2ba71e59c57f2e625a88184970f573f84e59493dc9e136a6dcd77ee3e55702",
      "source_scope_sha256": "sha256:3d816f53c3df64a5555737c1b04284fabb41200040f2e5ffb80d9c8e93e18814",
      "created_at_basis": "First durable Git commit containing the source candidate packet."
    },
    "playbook_consumer_contract": {
      "repository": "fawxzzy/playbook",
      "observed_revision": "8aa912b492e689fca4c296d59a438c2813cba4fc",
      "contract_path": "packages/engine/src/memory/atlasCandidateAdmission.ts",
      "accepted_mapping": {
        "kind": "rule",
        "destination": "Playbook/rules"
      }
    }
  }
}
